{
  "schema_version": 1,
  "receipt_id": "33333333-3333-4333-8333-333333333333",
  "intent_id": "11111111-1111-4111-8111-111111111111",
  "correlation_id": "22222222-2222-4222-8222-222222222222",
  "request_id": "req-01HZY.machine-boundary_001",
  "idempotency_key": "campaign-eeee-week37-gate-M00-seq-1",
  "intent_content_hash": "9999999999999999999999999999999999999999999999999999999999999999",
  "capability_hash": "aaaaaaaaaaaaaaaaaaaaaaaaaaaaaaaaaaaaaaaaaaaaaaaaaaaaaaaaaaaaaaaa",
  "status": "validation_accepted",
  "validated_at": "2026-07-20T00:00:01Z",
  "reason_code": null
}
